eng,darija_ar,transl
I hope you are making the most of the bank holidays this week to change your ideas,كانتمانا تاستافاد ل أقصا حاد من لعوتا هاد سيمانا باش تبادال أفكارك,We should take advantage of the maximum benefit from our meeting this week to exchange ideas.
please could you just sear the beef in a pan and put it on to slow roast,"عافاك, واش تقدار تحامار لحام لبڭار فلماقلا أُ تحاطو ف إتحمّر بشويا","Please, can you grill the meatballs on the barbecue until they are slightly browned?"
"We will have an exam, if that is what you mean, next week on Thursday","غادي يكون عاندنا متيحان, إلا كان هادشي ليكاتقساد, سيمانا جايا نهار لخميس","We will have a test, otherwise this will be confusing, next week on Thursday."
the shopper paid with cash to avoid credit card fees,لكليان خلسّ شاسه باش مايديوش ليها لبانكا شي داراإب إلا ستاعمل كارتا,Both of them secretly planned so that the bank doesn't know about the house they bought unless they make a card.
"let's plan a movie night soon, i've got a list of must watch films","تانختارو شي اليلا نتفرجو فيها فشي فيلم, راني موجد ليستا ديال لفيلمات","You guys choose a movie to watch tonight, I'm not up to date with the latest films."
"i've been trying to drink more water, but i cant get off coffee","شحال و أنا كانجرب نشرب كتر ديال لما, والاكين ماقدرتش نحييد لقهوا","I tried to drink a lot of water, but I couldn't resist the coffee."
i wish i could go back in time and relive those carefree summer vacations,ماكرهتش نرجع بلوقت و نعاود نعيش عوتال سيف فين راسّي كيكون خاوي,I don't want to go back in time and relive the same old battles where my head ends up empty.
